{
    "v": "ACDC10JSON000514_",
    "d": "EMVnFMfhcw67coSNnH5nqi5fWtFreCNuw6pGVGdMFuSx",
    "i": "ENro7uf0ePmiK3jdTo2YCdXLqW7z7xoP6qhhBou6gBLe",
    "ri": "EFfjfmq3DiHAbVWiF4VA24fP5OEIV1EhWoO-v3ZqmVG6",
    "s": "EN6Oh5XSD5_q2Hgu-aqpdfbVepdpYpFlgz6zvJL5b_r5",
    "a": {
        "d": "EHQgqNNSueVmVjlErrGtzjl-HJya9rMUiNadDSkZQ1kV",
        "dt": "2023-11-13T17:41:37.710691+00:00",
        "ids": [
            "did:webs:foo.com:ENro7uf0ePmiK3jdTo2YCdXLqW7z7xoP6qhhBou6gBLe",
            "did:web:example.com:ENro7uf0ePmiK3jdTo2YCdXLqW7z7xoP6qhhBou6gBLe"
        ]
    },
    "r": {
        "d": "EEVTx0jLLZDQq8a5bXrXgVP0JDP7j8iDym9Avfo8luLw",
        "aliasDesignation": {
            "l": "The issuer of this ACDC designates the identifiers in the ids field as the only allowed namespaced aliases of the issuer's AID."
        },
        "usageDisclaimer": {
            "l": "This attestation only asserts designated aliases of the controller of the AID, that the AID controlled namespaced alias has been designated by the controller. It does not assert that the controller of this AID has control over the infrastructure or anything else related to the namespace other than the included AID."
        },
        "issuanceDisclaimer": {
            "l": "All information in a valid and non-revoked alias designation assertion is accurate as of the date specified."
        },
        "termsOfUse": {
            "l": "Designated aliases of the AID must only be used in a manner consistent with the expressed intent of the AID controller."
        }
    }
}